{
  "schema_version": "2026-05-14-v1",
  "purpose": "Control LUT for baseline_ipmsm_v1 motor, generated from linear_dq model",
  "unit_convention": {
    "dq_transform": "amplitude_invariant",
    "current": "phase_peak_ampere",
    "voltage": "phase_peak_volt",
    "speed": "mechanical_rpm_input_and_electrical_rad_per_second_internal"
  },
  "pole_pairs": 4,
  "model_source": {
    "model_type": "linear_dq",
    "linear_dq_ref": "models/motor_params.json",
    "flux_lut_ref": null,
    "experiment_ref": "experiments/exp_001_linear_dq/",
    "search_config": {
      "search_type": "min_current_for_torque",
      "current_grid": {
        "id_min_a": -260.0,
        "id_max_a": 40.0,
        "iq_min_a": 0.0,
        "iq_max_a": 260.0,
        "step_a": 2.0
      }
    }
  },
  "motor_params_ref": "models/motor_params.json",
  "operating_limits": {
    "vdc_v": 360.0,
    "vmax_v": 207.8460969082653,
    "imax_a": 260.0,
    "speed_max_rpm": 18000.0,
    "temperature_c": 25.0
  },
  "grid_definition": {
    "speed_axis_rpm": [
      0.0,
      250.0,
      500.0,
      750.0,
      1000.0,
      1250.0,
      1500.0,
      1750.0,
      2000.0,
      2250.0,
      2500.0,
      2750.0,
      3000.0,
      3250.0,
      3500.0,
      3750.0,
      4000.0,
      4250.0,
      4500.0,
      4750.0,
      5000.0,
      5250.0,
      5500.0,
      5750.0,
      6000.0,
      6250.0,
      6500.0,
      6750.0,
      7000.0,
      7250.0,
      7500.0,
      7750.0,
      8000.0,
      8250.0,
      8500.0,
      8750.0,
      9000.0,
      9250.0,
      9500.0,
      9750.0,
      10000.0,
      10250.0,
      10500.0,
      10750.0,
      11000.0,
      11250.0,
      11500.0,
      11750.0,
      12000.0,
      12250.0,
      12500.0,
      12750.0,
      13000.0,
      13250.0,
      13500.0,
      13750.0,
      14000.0,
      14250.0,
      14500.0,
      14750.0,
      15000.0,
      15250.0,
      15500.0,
      15750.0,
      16000.0,
      16250.0,
      16500.0,
      16750.0,
      17000.0,
      17250.0,
      17500.0,
      17750.0,
      18000.0
    ],
    "torque_axis_nm": [
      100.0
    ],
    "speed_step_rpm": 250.0,
    "torque_step_nm": 0.0,
    "interpolation_method": "nearest",
    "extrapolation_policy": "clamp"
  },
  "control_points": [
    {
      "speed_rpm": 0.0,
      "torque_nm": 100.0,
      "id_a": -122.0,
      "iq_a": 198.0,
      "actual_torque_nm": 100.12464000000001,
      "control_mode": "MTPA",
      "feasible": true,
      "infeasibility_reason": null,
      "current_a": 232.568269546815,
      "voltage_v": 8.139889434138526,
      "voltage_margin_v": 199.70620747412678,
      "current_margin_a": 27.431730453184997,
      "copper_loss_w": 2839.6200000000003,
      "efficiency": null,
      "search_method": "min_current",
      "confidence": "high"
    },
    {
      "speed_rpm": 250.0,
      "torque_nm": 100.0,
      "id_a": -122.0,
      "iq_a": 198.0,
      "actual_torque_nm": 100.12464000000001,
      "control_mode": "MTPA",
      "feasible": true,
      "infeasibility_reason": null,
      "current_a": 232.568269546815,
      "voltage_v": 16.625047252303958,
      "voltage_margin_v": 191.22104965596134,
      "current_margin_a": 27.431730453184997,
      "copper_loss_w": 2839.6200000000003,
      "efficiency": null,
      "search_method": "min_current",
      "confidence": "high"
    },
    {
      "speed_rpm": 500.0,
      "torque_nm": 100.0,
      "id_a": -122.0,
      "iq_a": 198.0,
      "actual_torque_nm": 100.12464000000001,
      "control_mode": "MTPA",
      "feasible": true,
      "infeasibility_reason": null,
      "current_a": 232.568269546815,
      "voltage_v": 25.732173175093376,
      "voltage_margin_v": 182.11392373317193,
      "current_margin_a": 27.431730453184997,
      "copper_loss_w": 2839.6200000000003,
      "efficiency": null,
      "search_method": "min_current",
      "confidence": "high"
    },
    {
      "speed_rpm": 750.0,
      "torque_nm": 100.0,
      "id_a": -122.0,
      "iq_a": 198.0,
      "actual_torque_nm": 100.12464000000001,
      "control_mode": "MTPA",
      "feasible": true,
      "infeasibility_reason": null,
      "current_a": 232.568269546815,
      "voltage_v": 34.978785292159124,
      "voltage_margin_v": 172.86731161610618,
      "current_margin_a": 27.431730453184997,
      "copper_loss_w": 2839.6200000000003,
      "efficiency": null,
      "search_method": "min_current",
      "confidence": "high"
    },
    {
      "speed_rpm": 1000.0,
      "torque_nm": 100.0,
      "id_a": -122.0,
      "iq_a": 198.0,
      "actual_torque_nm": 100.12464000000001,
      "control_mode": "MTPA",
      "feasible": true,
      "infeasibility_reason": null,
      "current_a": 232.568269546815,
      "voltage_v": 44.27758178522463,
      "voltage_margin_v": 163.56851512304067,
      "current_margin_a": 27.431730453184997,
      "copper_loss_w": 2839.6200000000003,
      "efficiency": null,
      "search_method": "min_current",
      "confidence": "high"
    },
    {
      "speed_rpm": 1250.0,
      "torque_nm": 100.0,
      "id_a": -122.0,
      "iq_a": 198.0,
      "actual_torque_nm": 100.12464000000001,
      "control_mode": "MTPA",
      "feasible": true,
      "infeasibility_reason": null,
      "current_a": 232.568269546815,
      "voltage_v": 53.601410625186546,
      "voltage_margin_v": 154.24468628307875,
      "current_margin_a": 27.431730453184997,
      "copper_loss_w": 2839.6200000000003,
      "efficiency": null,
      "search_method": "min_current",
      "confidence": "high"
    },
    {
      "speed_rpm": 1500.0,
      "torque_nm": 100.0,
      "id_a": -122.0,
      "iq_a": 198.0,
      "actual_torque_nm": 100.12464000000001,
      "control_mode": "MTPA",
      "feasible": true,
      "infeasibility_reason": null,
      "current_a": 232.568269546815,
      "voltage_v": 62.9391478914577,
      "voltage_margin_v": 144.9069490168076,
      "current_margin_a": 27.431730453184997,
      "copper_loss_w": 2839.6200000000003,
      "efficiency": null,
      "search_method": "min_current",
      "confidence": "high"
    },
    {
      "speed_rpm": 1750.0,
      "torque_nm": 100.0,
      "id_a": -122.0,
      "iq_a": 198.0,
      "actual_torque_nm": 100.12464000000001,
      "control_mode": "MTPA",
      "feasible": true,
      "infeasibility_reason": null,
      "current_a": 232.568269546815,
      "voltage_v": 72.28540376608558,
      "voltage_margin_v": 135.56069314217973,
      "current_margin_a": 27.431730453184997,
      "copper_loss_w": 2839.6200000000003,
      "efficiency": null,
      "search_method": "min_current",
      "confidence": "high"
    },
    {
      "speed_rpm": 2000.0,
      "torque_nm": 100.0,
      "id_a": -122.0,
      "iq_a": 198.0,
      "actual_torque_nm": 100.12464000000001,
      "control_mode": "MTPA",
      "feasible": true,
      "infeasibility_reason": null,
      "current_a": 232.568269546815,
      "voltage_v": 81.63725253816162,
      "voltage_margin_v": 126.20884437010369,
      "current_margin_a": 27.431730453184997,
      "copper_loss_w": 2839.6200000000003,
      "efficiency": null,
      "search_method": "min_current",
      "confidence": "high"
    },
    {
      "speed_rpm": 2250.0,
      "torque_nm": 100.0,
      "id_a": -122.0,
      "iq_a": 198.0,
      "actual_torque_nm": 100.12464000000001,
      "control_mode": "MTPA",
      "feasible": true,
      "infeasibility_reason": null,
      "current_a": 232.568269546815,
      "voltage_v": 90.99296978538203,
      "voltage_margin_v": 116.85312712288328,
      "current_margin_a": 27.431730453184997,
      "copper_loss_w": 2839.6200000000003,
      "efficiency": null,
      "search_method": "min_current",
      "confidence": "high"
    },
    {
      "speed_rpm": 2500.0,
      "torque_nm": 100.0,
      "id_a": -122.0,
      "iq_a": 198.0,
      "actual_torque_nm": 100.12464000000001,
      "control_mode": "MTPA",
      "feasible": true,
      "infeasibility_reason": null,
      "current_a": 232.568269546815,
      "voltage_v": 100.35147354562181,
      "voltage_margin_v": 107.4946233626435,
      "current_margin_a": 27.431730453184997,
      "copper_loss_w": 2839.6200000000003,
      "efficiency": null,
      "search_method": "min_current",
      "confidence": "high"
    },
    {
      "speed_rpm": 2750.0,
      "torque_nm": 100.0,
      "id_a": -122.0,
      "iq_a": 198.0,
      "actual_torque_nm": 100.12464000000001,
      "control_mode": "MTPA",
      "feasible": true,
      "infeasibility_reason": null,
      "current_a": 232.568269546815,
      "voltage_v": 109.71205074750053,
      "voltage_margin_v": 98.13404616076478,
      "current_margin_a": 27.431730453184997,
      "copper_loss_w": 2839.6200000000003,
      "efficiency": null,
      "search_method": "min_current",
      "confidence": "high"
    },
    {
      "speed_rpm": 3000.0,
      "torque_nm": 100.0,
      "id_a": -122.0,
      "iq_a": 198.0,
      "actual_torque_nm": 100.12464000000001,
      "control_mode": "MTPA",
      "feasible": true,
      "infeasibility_reason": null,
      "current_a": 232.568269546815,
      "voltage_v": 119.07421240426896,
      "voltage_margin_v": 88.77188450399635,
      "current_margin_a": 27.431730453184997,
      "copper_loss_w": 2839.6200000000003,
      "efficiency": null,
      "search_method": "min_current",
      "confidence": "high"
    },
    {
      "speed_rpm": 3250.0,
      "torque_nm": 100.0,
      "id_a": -122.0,
      "iq_a": 198.0,
      "actual_torque_nm": 100.12464000000001,
      "control_mode": "MTPA",
      "feasible": true,
      "infeasibility_reason": null,
      "current_a": 232.568269546815,
      "voltage_v": 128.4376120309082,
      "voltage_margin_v": 79.4084848773571,
      "current_margin_a": 27.431730453184997,
      "copper_loss_w": 2839.6200000000003,
      "efficiency": null,
      "search_method": "min_current",
      "confidence": "high"
    },
    {
      "speed_rpm": 3500.0,
      "torque_nm": 100.0,